input_text,vibe_label,label
"Categories: Bars, American (Traditional), Gastropubs, Nightlife, Cocktail Bars, Restaurants, American (New) | Review: My friend and I came for happy hour and we loved it! We got three things on the happy hour menu: the chicken & waffle bites, the sausage & garlic pizza, and the buffalo cauliflower. We also each got a Raspberry Smash to drink & they were pretty strong!

I loved the buffalo cauliflower. I make a baked version of this at home, so I was surprised when it came out fried, but it was DELICIOUS. My friend liked the sausage & garlic pizza but I thought the garlic was a bit too raw. The chicken & waffle bites were okay; neither of us liked them too much. I wouldn't order it again.

But our server was a sweetheart, which is why I'm giving Finney's five stars. He kept cracking jokes when he came by to check in on us. Made our experience even better! Overall this is a solid happy hour spot in SB.",casual_hangout,2
"Categories: Restaurants, Food, Cafes, Mediterranean, Middle Eastern | Review: Basic mediterranean nothing special here. Points for being after midnight go-to. Owner is a nice dude, Kilo or Phylo or something. Staff b.s. around with each other (talk, laugh) so orders take longer than they would if they were concentrating. Seems to attract a more ghetto late night crowd than the Blue Owl & I'm sure being right next to a smoke shop (hookah shop? Don't know I didn't go in) helps with that. Mad amounts of Taxis park in front so unless you like shady looking mexican dudes staring at you while you grub get it to go. Not much room to eat inside, never tried it.",late_night,6
"Categories: Caterers, Event Planning & Services, Ice Cream & Frozen Yogurt, Desserts, Food | Review: The best ice cream ever!  A bit pricey...
Don't miss the Passion Fruit Cream or the Cup of Joe flavors
I hope Rori's expands its locations to Orange County, CA 
Amazing gourmet ice cream
PS - I'm very picky and they did not ask me to write a review",family_friendly,3
"Categories: Restaurants, Japanese, Ramen | Review: I was surprised to hear that a new ramen shop had opened up in Goleta and honestly did not have very high expectations at all. Goleta has a lack of good Asian food in general, so I was expecting some kind of pseudo-Japanese-y restaurant serving random noodles because there is no actual ramen in the area to compare it to. To my pleasant surprise, I was wrong and the ramen here is delicious!!!

Having lived in Tokyo for the past year, I have tried many, many ramen shops (including the famous one Michelin-starred Tsuta, which is actually cheaper than this place btw!!) and often find myself missing the convenience and comfort of a good bowl of ramen here in Goleta. This place fills the emptiness I feel sometimes and is comparable to ramen I've had in Japan!

I've been here 3 times now and have gotten the Kuro ramen twice and Aka ramen once. I definitely prefer the Kuro because I love garlic, but they share the same broth so they aren't too different. The tonkotsu broth is suupeeerrr thick and fatty just like it should be, but that also means it feels really heavy and makes you tired after. It's still definitely worth it though and I crave it all the time!! The only thing I didn't really like was the chicken karaage; it was wayy too expensive and really not special in anyway. All in all, I highly recommend this place!",upscale,4
"Categories: Comfort Food, Asian Fusion, Chinese, Tapas/Small Plates, Noodles, Thai, Restaurants | Review: I got the curry noodle soup it was really good!!! The service could be better tho. I found a little fly in the sauce but it was overall a clean place.",trendy,5
"Categories: Nightlife, Bars, Cocktail Bars, Food, American (New), Desserts, Restaurants | Review: This is a must visit in Santa Barbara. The ambiance is great, the food is hands down amazing, and the drinks and service here is impeccable.

Came here for dinner on a nice Saturday night - my friend had made reservations for 9 pm (called earlier in the week and that was the only slot available). We arrived around 8 to see if we could get in, and they happened to have a free table for us.

We were seated outside near a small fire pit next to the bar so on a cool southern california night it was perfect. This restaurant is great for groups because the menu is designed for sharing and you can try all the different flavors the Lark has to offer. 

After ordering drinks (I got the Smoke 'n' Roses - that had a great smoky mescale), we were served some of their signature popcorn - AMAZING. We even had seconds! 

For our table of 4, we ordered the Crispy Brussel Sprouts, the Pear and Red Kale Salad, Crispy Smoked Pork Belly, Pappardelle and Lamb, and Roasted Arctic Char. 

The brussel sprouts are a MUST order - the most amazing I've ever had. The kale is nice and refreshing, and the Pork Belly is sweet and tender that it just melts in your mouth (a must order as well!) . The pappardelle is handmade and the lamb was tender and crispy. The Arctic Char had a great flavoring too. 

The entire staff there is accommodating and attentive and my whole party was very pleased. Our waiter even mentioned how all the chefs begin preparing in the morning at 7 am so that all the food served is the most fresh! 

I will definitely be coming back!!",upscale,4
"Categories: Food, Ice Cream & Frozen Yogurt, Desserts | Review: Ugh...really sad about this place. Maybe I got something super basic, which was the ""Pretty Please Sundae."" Or maybe it was because the guy that served me was just ok. (He was wearing a backwards hat and a north face jacket). Wasn't rude or anything, but didn't seem very welcoming as the other staff seemed to be. On top of that, it took forever for my order. He prepared the first part of my sundae, which was the ice cream, chocolate grenache and sprinkles. Then he left it out and went to the back to what I think was refilling the whipped cream canister thingy.  

I was waiting on the side and can see him standing there shaking the thing for a good 10 minutes. Naturally, when he finally finished, the ice cream came melted and watery.  I'm like, that's fine, hopefully it's bomb and it will make up for it. Nope.  I think the self serve ice cream that you make your self is about equivalent to what I had.

If I ever comeback, which is a maybe..I'll just go for another specialty flavor which they have so much of.",trendy,5
"Categories: Chinese, Food, Dim Sum, Desserts, Coffee & Tea, Restaurants | Review: Great tasting Chinese food at China Pavilion. There were hits and there were misses but overall I would recommend.

The hits:
Silver Sprout Duck Soup - Wooow! Google won't help much with this dish as it is a Chinese Pavilion exclusive. But I took a chance on it and it was great. Broth is like hot and sour but the duck takes it much further. I was under the weather but this soup cradled me like a mother. I only wish the bowl was bigger! 

Spicy Basil Ginger Beef - The name says it all, and the dish is exactly what it promises to be. And it is so so good.

The miss:
Crispy Prawns with Garlic
Weird batter, overall just underwhelming dish. The batter is just weird, see the picture.

Interior and service = solid.",study_spot,1
"Categories: Restaurants, Event Planning & Services, American (Traditional), Venues & Event Spaces | Review: I found my meal ordinary and average, but quite expensive.   I expect and am willing to pay extra for gourmet food, or very healthy food, but my meal here was neither.   I didn't have a drink.   I gave it three stars, because it wasn't bad food, just average and over priced.  I won't return.",upscale,4
"Categories: Breweries, Nightlife, Food, Cocktail Bars, Bars, Restaurants, Brewpubs, Gastropubs | Review: My friend was just walking by the Cruisery and a guy was outside blocking the sidewalk & they yelled at my friend to get out of there zone & he apologized & then the guy said to my friend your a real smart ass , my friend ignored him and went and  ordered food from "" Hana Kitchen "" ( they have great food ) while waiting for his order another guy came out and my friend said to the guy that other people might get confused also & he told my friend "" your a breath of fresh air and you probably will die from cancer soon 

How is that for customer service I want everyone to know about what happened and to think twice about going there",date_night,0
"Categories: Nightlife, Seafood, American (Traditional), Bars, Restaurants | Review: Overpriced as are most restaurants on the warf. However, good place to take kids (they can be loud and not bother anyone) and has a pretty good clam chowder, decent food and drinks that pack quite a punch.",late_night,6
"Categories: Restaurants, Mexican | Review: Carlito's has a nice outdoor area, but the hostess was snobby and the service was slow. More expensive that the $$ rating shown in the description IMO...",upscale,4
"Categories: Food, Bubble Tea, Chinese, Restaurants, Asian Fusion, Hot Pot | Review: There are so many different combinations of hot pot and every one I tried was delicious! My personal favorite would have to be the Korean Army Stew. It really hits the spot for Asian food! The service is also amazing and their COVID outdoor seating is nice and seems very sanitary as well. Definitely must try!!",study_spot,1
"Categories: Food, Ice Cream & Frozen Yogurt, Desserts | Review: Best ice cream ever!!! Great service, let us sample as many flavors as we wanted and gave recommendations. I'll be back for some more tomorrow :)",family_friendly,3
"Categories: Breakfast & Brunch, American (New), Restaurants, American (Traditional), Nightlife, Bars | Review: Great location. Friendly Staff. Conveniently located inside Canary Hotel. I ordered the breakfast Slow Poached Eggs, Toasts, & Fresh Fruits. It was okay not amazing. I've had better. Eggs were over cooked for being slow poached. Overall experience was 4 stars!",family_friendly,3
"Categories: Food, Coffee & Tea, Juice Bars & Smoothies, Herbs & Spices, Specialty Food, Health Markets | Review: Really nice owner and ingredients, however the store hours were fairly inconsistent in the past.",study_spot,1
"Categories: Nightlife, Bars, Cocktail Bars, Food, American (New), Desserts, Restaurants | Review: The Lark is The bomb! Pricey but worth it! Every bite we took created an amazing happy sensation! 
A true party in your mouth!! 

Strongly recommend the crispy Brussels Sprouts and the Southern Pimento Cheese! 

The Goat cheese cheesecake Profiteroles -- amazing!!! Very flavorful! The Carrot and Creamsicle cake is great if you love Carrot cake. Hazelnut (alcoholic)  latte will warm up your body and soul!

Superb experience! Friendly staff! Decor is warm and classy! Delicious drinks too! They surprised me with two drinks based on some ingredients I like... Winner!!",late_night,6
"Categories: Garage Door Services, Restaurants, Live/Raw Food, Food, Home Services, Mediterranean, Keys & Locksmiths, Burgers, Vegetarian, Juice Bars & Smoothies, Vegan, Salad | Review: so...it's about time I've written a thoughtful, well deserved review for mesa verde. Ever since I started coming here, maybe two years ago, it has been my favorite restaurant in Santa Barbara. This is my boy friend and I's favorite spot! The service is so friendly and accommodating and the two co-owners are great! Although I myself am vegan, my vegan AND non vegan friends have loved the food (especially the STREET TACOS)! the atmosphere is really beautiful, unique and surprisingly feels really intimate and quiet for its location. If I'm not mistaken I've seen some of the staff at the farmers market before, I assume getting the best quality produce for their restaurant, so that's an awesome sign. The desserts keep getting better and better I love the chocolate cake but the cheese cake is also incredible... and I thought I didn't like cheese cake! I literally have nothing bad to say about this place. Do yourself a favor and go here, seriously!",casual_hangout,2
"Categories: Diners, Salad, American (Traditional), Breakfast & Brunch, Restaurants | Review: I ate here Sunday afternoon after driving to Norton's and discovering they are closed on Sunday! It's near my work so I figured what the heck!? I was starving and for some reason the fish and chips sounded like a good idea. Normally I only order fish at a fish restaurant and it has to be near the water; Sambo's only meets one of the aforementioned criteria. Fish on the menu claims to be battered but definitely came out of a frozen box, already breaded. Fish was chewey. The locals have described this place as the original ""Denny's."" Usually packed out front - ocean front views!! I will have to eat here for breakfast to see if they can win me over.",family_friendly,3
"Categories: Event Planning & Services, Latin American, Caterers, Food, Restaurants, Empanadas, Argentine | Review: Freshest Empanadas. Right out of the oven. Super yummy taste. Outdoor sitting. The only downside is that they are only offering limited options.",casual_hangout,2
"Categories: Bars, Nightlife, Pubs, Comedy Clubs | Review: One of the few places on State St. where you can get a unique drink. The bartender was really helpful in helping choose which drink to order. There are several booths (which you don't see at bars) and high tables.

I got the Washington Apple and it's definitely apple with a kick.",late_night,6
"Categories: Italian, Restaurants | Review: My boyfriend and I LOVE this place!  We ate here about a year ago while staying in Carpinteria and decided to go back for Valentines Day this year. The chef, who is the owner's son, has greeted us every time we have been in and has served us our dinner previously.  The food is wonderful, plated well and the service prompt and caring.  We went for lunch after a hike on V-Day and then went back for dinner.  They had no problem getting us in on such a busy night even with no reservation.  The patio was pretty at night with the twinkling lights and the heaters were great for such a cool night.  One of these days we are going to have to try someplace else in Carp.  =)  P.S. The ravioli is amazing, bruchetta too...",upscale,4
"Categories: Restaurants, Food, Breweries, American (Traditional), Brewpubs | Review: Sub par beer and the chimmichurri tri tip sandwich was pretty bad, first of all there was no chimmichurri sauce in the sandwich. I don't think they know what chimmichurri is. There was salsa of some sort and sprigs of cilantro, the tri tip was dry and over done, the ciabatta bread was the best part of the sandwich. Duck fat fries, didn't taste the duck far at all.",casual_hangout,2
"Categories: Szechuan, Chinese, Nightlife, Karaoke, Asian Fusion, Restaurants | Review: Great meal delivered hot and on time. Loved the chicken wings and green beans. Nice and spicy.",trendy,5
"Categories: Comfort Food, Asian Fusion, Chinese, Tapas/Small Plates, Noodles, Thai, Restaurants | Review: Don't do it.  
No seasoning, no passion, no quality, no flavor. 
The beef salad was inedible--I think rancid rice was scorched for the rice powder. The dish tasted like kerosene. 
Pad Thai was devoid of flavor. 
Duck buns were gristly and gloppy.
Lettuce cups totally bland.  
Really, truly awful food.",trendy,5
"Categories: Restaurants, Food, French, Coffee & Tea, Bakeries, Breakfast & Brunch | Review: Amazing croissants and kouign-ammans (pronounced like ""queen Amman""), just like in France! They make scrambled eggs like nowhere else - seriously you'll become addicted because they are so incredible! The owners are delightful francais too :)",study_spot,1
"Categories: Lounges, Nightlife, Restaurants, Bars, Seafood, American (Traditional), Soup | Review: Enterprise has been a must go to place whenever we're in town, but this last visit was questionable. 

We were seated in the happy hour section and waited there for 20 minutes.  I finally got my own happy hour menu, waved down a waitress to ask where our server was, and were offered drinks. The server was apologetic and said there was a misunderstanding on who was supposed to serve us. Okay, I just saw you taking the order for the table next to us that was seated just 5 minutes ago but okay. Food was good and prompt. We have oysters on the half shell, Hawaiian poke, and the lobster special. Plentiful for the two of us. 

The check came and the happy hour specials were not applied. We pointed it out and it was corrected promptly. 

That was just too much. We don't know if both were honest mistakes but it would've been nice to be given a free dessert or appetizer for all of this.",late_night,6
"Categories: Thai, Vegetarian, Noodles, Restaurants, Asian Fusion | Review: It is such a cute place and they have friendly service. Still, the best I can say of the meal is that it was inoffensive.  The vegetables didn't taste like they had been integrated with the sauces.  It was like the green beans were tossed in the tempura or the curry and they just tasted like green beans. The yellow curry was on the sweat side.  The Pad Thai was good but again suffered because the flavors weren't melded.",trendy,5
"Categories: Breakfast & Brunch, Diners, Restaurants, American (Traditional) | Review: My husband and I opted for breakfast here on Sunday 4th of July weekend before heading back home. The wait was LONG however we didn't mind because from our experience it's usually a good sign. Hmmm... There was this guy walking around, but mostly behind the bar for the most part....his shirt was white and extremely DIRTY not food dirty but DIRTY DIRTY and I must say really grossed me out (he wasn't cooking or I would have walked out). Everyone was really nice but looked frantic/disorganized. They kept apologizing I think they knew it was an off day maybe they were extremely short staffed. A LOT of people were complaining... My husband & I sat at the bar so we noticed it all. My food was pretty good (not sure if it was worth the hour wait out side + plus hour wait inside) & my OJ was delicious. He LOVED his food so we were happy campers when we left. 


Will give it another try and see what happens.",family_friendly,3
"Categories: Delis, Gluten-Free, Fast Food, Salad, Sandwiches, Restaurants | Review: First time here and had an absolutely incredible experience! Not only was the food amazing (I got the crispy chicken west) BUT the ambiance and people were friendly and very eager to create a genuine experience! The manager, Owen, greeted me as soon as I walked in the door and gave me a complete run down of the menu, even recommending some things based on what wanted! He was helpful and knowledgeable about the menu, very easy to talk to and created an all around wonderful experience. I will definitely be back for great food and even better customer service.",study_spot,1
"Categories: Burgers, Cafes, Restaurants, Mexican, American (Traditional) | Review: Good food, they didn't rush us when we were eating last closing. The fish tacos were BOMB!",study_spot,1
"Categories: Restaurants, Mexican | Review: Honestly, this place is all hype. It's basic. Yea the tortillas are good because they're handmade, the guac is basic, the bistec is basic. The horchata was delicious though. I just wasn't impressed....chipotle is better.",trendy,5
"Categories: Restaurants, Chinese, Vegetarian | Review: This was our first time ordering food from
Shang Hai and it's a great discovery!!! They have an extensive vegetarian menu and as a mainly plant-based family, it made us happy to have so many choices. We ordered the vegetable chowmein (soft noodles), vegetable tofu dish and veggie combo (veggie chicken and veggie beef) pan-fried noodles. Each entree was delicious and full of flavor. We were amazed at the deliciousness of the veggie chicken and veggie beef. As vegetarians, it's always a nice treat to find faux meats prepared so well! The only downside was that the pan fried noodles were a different noodle from what other places use and not crispy. It didn't have the pan-fried, crunchy texture that is typical of that dish. At this
time, the restaurant was take-out only. The main man who took our order was helpful and nice! We will certainly return the next time we visit Santa Barbara. It's made it on our list of favorite food places in town.",casual_hangout,2
"Categories: Bars, American (Traditional), Restaurants, Cocktail Bars, Nightlife | Review: Solid everything. Excellent beer list, and great food and pizza. More vegetarian options would be nice.",casual_hangout,2
"Categories: Mexican, Vegan, Restaurants, Vegetarian | Review: Really tasty.  The ""meats"" have a lot of flavor and you leave with a lot of food.  (I usually take it to go.) Only complaint is it's EXPENSIVE!  A burrito shouldn't be $14!  Otherwise delish, I wish there were more quick/easy vegan options like this in town.",upscale,4
"Categories: Seafood, Bars, Wine Bars, American (New), Restaurants, French, Nightlife, Mexican | Review: The food was a bit disappointing.There is no attempt at innovation, just blandness and too much salt. 50\50 quality :(",date_night,0
"Categories: Food, Italian, Pizza, Fast Food, Gelato, Chicken Wings, Sandwiches, Salad, Restaurants | Review: Best pizza me and my husband have had. Very busy walk in restaurant that has their wood fired pizza ready within 10-15min. We live our wine and it was a nice surprise they had a good wine selection to pair with their amazing pizza. A must try for pizza lovers!",date_night,0
"Categories: Seafood, American (New), Salad, Restaurants, Sandwiches | Review: Food and wine were great, service good but not amazing. Fish tank bar was really cool, but the best thing is the view of the pacific in the plentiful outdoor seating. If you're staying at the 4 seasons, def worth checking out.",date_night,0
"Categories: Restaurants, Mexican | Review: Overall 3.5 stars is all Rose Cafe (2) gets?  
This is an amazing anytime place.  

This review is based on the ambiance and one glorious dish.  

Rose Cafe is relaxed, low lit, old red vinyl seating, and delicious.  I know everyone's got their SB hotspots and hangover cures, but I'll be damned.  The guadalajara chicken tacos are a great.  Loaded with guacamole, these lusciously stuffed shells of amazing, burst with flavor and scream satisfaction.  Rice and beans, loaded with lard and salt are a perfect side car.  And balanced with the light refreshing lettuce and and tomato, are super tasty.  

Please try them.",study_spot,1
"Categories: Bars, Burgers, Restaurants, Nightlife, Sports Bars, American (New) | Review: Best local spot in town. Amazing wait staff and the the manager Brandy will go above and beyond to make sure you have a amazing meal and experience! She adds a personal touch to every trip that makes you feel welcome. Best burgers, beer and Brandy in town!!!",casual_hangout,2
"Categories: Restaurants, Italian, Pizza | Review: OH MY GOODNESS! The pizza here is incredible! Very pricey but very good. I have never eaten in house because it's always packed so I always order for pick up. The salads are small but very good as well. I will have to call and make Reservations if I'd like to experience the sit down dining. Every time I go to pick up my order the staff is a little snooty and has a bit of an attitude like I'm inconveniencing them by my Togo order, but Iv lived here long enough to know that attitude comes with the territory....mooonteeecitooo!",casual_hangout,2
"Categories: Coffee & Tea, Food, Coffee Roasteries | Review: Sadly, this isn't my favorite coffee in town. This location is ideal because its right off of State Street and can get a pick-me-up in a pinch. I have had the drip coffee and the cold brew and both seem watered down and no flavor. The staff is great and they are open later than other coffee shops but maybe their espresso drinks are a better option? 

They have a table with chairs outside and then more seating out in the street which is lovely, now that they closed off State Street to cars. I will have to just try again!",study_spot,1
"Categories: Food, American (New), Thai, Restaurants, Asian Fusion, Desserts, Cafes, Sandwiches, Caterers, Event Planning & Services | Review: Quick, clean, scrumptious, with nice employees and interior design.",study_spot,1
"Categories: Restaurants, Pizza, Italian | Review: Pizza was probably the best I have ever had. You could taste every flavor on the pizza. In the bar ( cooking) area it was very hot (some what expected). I look foward to a dine in experience and some more great food!",casual_hangout,2
"Categories: Breakfast & Brunch, Restaurants, Bakeries, Food, Australian | Review: Would give half a star if possible the WORST! I ordered the jalapeño biscuit with egg,cheese n bacon plus a avocado I received a hugh hard biscuit , a sliver of bacon no avocado and dried up hard cheese.",family_friendly,3
"Categories: Cocktail Bars, Fish & Chips, Nightlife, Seafood, Restaurants, Bars | Review: This place is good, their views from the patio are gorgeous especially at sunset. The clam chowder and oysters were delicious. Service was great!",date_night,0
"Categories: Delis, Restaurants | Review: So from all over the place I've been hearing about the late night menu which includes some supposed great mac n' cheese so I figure I'd give it a shot...and ofcourse get a Gyro to go with it...
1)I'm pretty sure this is the best Gyro in SB but I don't think it has any competition in that regard, please let me know if i'm wrong because Greek House is just a step above Daphne's (a southern cali...greek chain) I'd gladly try any other Gyro's in SB, but because i'm not aware of any others, I'll keep going to GH for it
2)The Mac n' Cheese is a joke..pretty sure its Velveeta crap and for a couple dollars extra some crappy chicken with tobasco sauce( 'Cajun Style') and fried onions...folks keep your money in your wallets, this stuff is garbage..",late_night,6
