input_text,vibe_label,label
"Categories: Salad, Sandwiches, Restaurants, Pizza, Italian | Review: pizza is going downhill and consistency has suffered as of late. giovannis pizza used to be really good, but it seems theyre beginning to cut corners, or perhaps they have new kitchen staff. wont be eating there regularly anymore.",study_spot,1
"Categories: Restaurants, Japanese, Ramen | Review: Happy place indeed! Came to Nikka for lunch with work friends. The food was great! excellent flavors, very large portions. Will come back for sure!",casual_hangout,2
"Categories: Restaurants, Chinese, Szechuan, Soup, Seafood | Review: This is a nice little Chinese place with delicious food. Of course I needed chili paste with my Chow Fun, but they brought it right away. My husband said his chicken and vegetable dish was the best he's ever had, and we've had hundreds! Sweet owners and chef seemed to care about our food!
We will be back! 
Thanks for such a pleasant meal!",upscale,4
"Categories: Restaurants, Japanese, Sushi Bars | Review: We finally got out to try Sun Sushi - so glad we did! This place definitely lives up to its reviews. 

I had the salmon 6-steps, and in addition to the killer presentation, I found the fish itself to be just perfect. Really fresh, cut just right (I am so picky about that), with correctly prepared and sized rice ball. 

My husband ordered the box sushi roll and the Albacore Delight roll. He said the Albacore roll was good but the box sushi was completely out of this world amazing, and gave me a bite so I could agree with him. Yes, it was, and I'll order it next time! For those who have been to Sakana and are hooked on their box sushi - this is a great alternative.

My daughter got the chef's choice sushi - 10 pieces of whatever the chef thought was best. This was pretty incredible, and I'm sorry for not grabbing a photo. There was no skimping on it as some restaurants try to do - no, this had all the premium nigiri: toro, uni, jumbo shrimp, two kinds of premium yellowtail... The birthday girl was suitably impressed with her order and even more excited when the waitress surprised her with tempura green tea ice cream at the end of the meal.

One of the highlights of the service here is that the servers take the time, when they bring your order, to point out and tell you what each thing on your plate is. So if you aren't enough of a sushi expert to be able to tell what everything is at a glance, never fear!
I definitely recommend this place - a little pricier but totally worth the spend, and it comes with great service and a pleasant, traditional atmosphere.",upscale,4
"Categories: Restaurants, Italian, Pizza | Review: Love this place and very grateful for its existence.
Awesome service. 
Pilgrimage worthy food. 
Can't wait to make the trek back to Bettina!",casual_hangout,2
"Categories: Steakhouses, Local Flavor, Nightlife, Fish & Chips, Restaurants, Seafood, Cocktail Bars, Bars | Review: Arch Rock has free corkage, so I took advantage and brought a bottle.  It was pretty amusing when the waitress asked if we wanted her to open it.  That would be YES, thank you.

The cioppino was good.",date_night,0
"Categories: Bars, Wine Bars, American (New), Nightlife, Restaurants | Review: Once again, a hit. I had the sblta which is a salmon blt with avo on a bomb foccacia bread. I had as a side their grilled veggies. A legit hit. And I NEVER eat bread! Of course I worked out at Fitzone plus I had 15000 steps or I would have had it lettuce wrapped lol. Hubby had the grilled salmon special- delish! The garlic mash was bomb and he also had the grilled veggies. Super delish! We washed it down with a bottle of Mac Murray Pinot. The waitresses were wonderful too. Natalie and Hailey. Our dog Lulu witnessed the whole debacle!",date_night,0
"Categories: Szechuan, Chinese, Nightlife, Karaoke, Asian Fusion, Restaurants | Review: We were disappointed in our take-out from this restaurant. We ordered mushu pork & the casings were not included.
The other entrees were not outstanding.",trendy,5
"Categories: Mexican, Restaurants | Review: I love great Mexican food, and Los Agaves definitely has it. The bf and I stood in a long line and had to wait a while to get a seat, but it was worth it. They have amazing guacamole and tomatillo sauce, as well as great salsas. I ordered the molcajete and it was solid, but not as good as my favorite spot in Mexico. Yes, I realize I'm comparing the food to actually eating in Mexico, but still, I always have high expectations. The rice was outstanding and the tortillas were nice and thick. My bf's dish was yummy too. I'll definitely come back to give it another try.",casual_hangout,2
"Categories: Nightlife, Dance Clubs, Bars | Review: If you're looking for a place to end your night, Tonic is it! Tonic is where you find your new age EDM and shots.",late_night,6
"Categories: Food, Vietnamese, Restaurants, Noodles | Review: was my go to pho place in sb for its pricing but after I forgot my glasses and called them, they reassured me they would keep it and not throw it away just for me to find out later when i came to pick it up that they threw away my glasses because the frame was broken  i don't see them throwing away their broken chairs and or fixing their bad service, so how do they think they have the right to throw away an expensive pair of glasses regardless of its condition, especially after i explicitly told them not to throw it away so i could come pick it up",upscale,4
"Categories: Bars, American (Traditional), Gastropubs, Nightlife, Cocktail Bars, Restaurants, American (New) | Review: What a delight and treat on a short vacation from Los Angeles. Alyssa behind the Bar was friendly, upbeat and provided amazing service. Tossing and shaking the drinks like a BOSS! Buffalo wings were full of meat and the buffalo cauliflower was recommend. Stop in! It's worth it!",late_night,6
"Categories: Restaurants, Chinese | Review: Has been a long since I have been here. Came a few weeks ago for a quick lunch and was not disappointed. The food was good and the service was descent.",casual_hangout,2
"Categories: Thai, Vegetarian, Noodles, Restaurants, Asian Fusion | Review: I have yet to have something I don't love. Their salmon salad and eggplant salad are amazing and their drunken noodles with tofu are my favorite. If there's a line it's worth the wait.",trendy,5
"Categories: Seafood, Restaurants, American (Traditional) | Review: had lunch here apr.21 with a group of 17. most had some sort of seafood.  my patty melt burger was about half cooked! most of the meals were in the $20.00 range, my burger was $16.00. if the ""chef"" can't cook a simple patty melt well done i can only wonder what he did to the seafood! will never go here again, but will tell everyone i know about this place.",upscale,4
"Categories: Restaurants, Sushi Bars, Japanese, Asian Fusion | Review: I have been here a handful of times. I give 5 stars to the DELICIOUS Green Tea Creme Brulee- yummmmm! My favorite sushi was the jellyfish. Great atmosphere, very trendy and cool, but loud. A little on the pricey side so its more of a special occasion type place.",trendy,5
"Categories: Nightlife, Bars, Cocktail Bars, Food, American (New), Desserts, Restaurants | Review: Very rude place. I made reservation early in the day and then later in the day they said they couldnt find my name. How hard would it be to properly notify someone,huh? I will spare the chefs for poor management this time.",upscale,4
"Categories: Mexican, Restaurants | Review: I always liked this place and considered it to be one of the better Mexican joints on Milpas. It just seems more authentic then some of the others and they had more vegetarian options. Plates come with rice and beans and they have sopas. Free chips and salsa as usual. Good service and god food.",trendy,5
"Categories: American (Traditional), Restaurants, Bars, Nightlife | Review: One of my favorite places. The atmosphere is fantastic, the people is draws are inclusive and fun, and their sandwiches are to die for. The vibe is the best when it's not covid and there is a live band playing music, but even without that, the food speaks for itself. I make sure to stop here every time I am in Santa Barbara!",study_spot,1
"Categories: Mexican, Restaurants | Review: My friend wanted to thank me by taking me to lunch, and this is where she wanted to go and I'm so glad that we did!

The server brought some warm chips and a mild salsa to the table. My friend likes spicy so I asked if they had a spicy salsa and it was brought right over ..very good and spicy. 

She had the shrimp chile relleno, offered me a taste and I must say it was an excellent  dish with a nice tomato cream sauce surrounding a chile stuffed with large shrimps and cheese.

I had the chicken alambre with tender chunks of chicken, mushrooms, onions, melted cheese, sliced avocado and tomato. If you get this meal ask for the tortillas on the side as the way this was presented, the not fresh made tortillas got a bit soggy and fell apart. 

Very good service, nice atmosphere (tablecloths and cloth napkins!). I will def go back here for more!",trendy,5
"Categories: Restaurants, Bars, Irish, Nightlife, Pubs, Gastropubs | Review: Drinks and atmosphere were great! And bartender was very knowledgable of the drinks and alcohol and very friendly and helpful.",late_night,6
"Categories: Restaurants, Italian | Review: Friday night early reservations during film festival. Great location and atmosphere yet with only fair food quality and poor attention to service we will probably dine elsewhere in the future.",upscale,4
"Categories: Restaurants, Food Delivery Services, Nightlife, Cocktail Bars, Food, Tapas Bars, Bars | Review: I love this place. I've gone through most of the food menu here and it's all quite tasty. The ""nice rack"" (rack o lamb)  is among my faves, along with filet con crema, and the prawns. 

Mixology is great here - blood orange margaritas/martinis when blood oranges are in season, their ginger mojito is delicious, and see if they have bleu cheese stuffed olives on hand. But save me some.",date_night,0
"Categories: Nightlife, Seafood, American (Traditional), Bars, Restaurants | Review: A great place to go if you're looking for a view. The food is pretty tasty, a little greasy but good food to cure a hangover. The burger with the onion ring and bacon (i think?) is to die for, and the fish and chips are pretty bomb too. Also, great cocktails. And you can't beat sitting on the pier, overlooking the ocean!",date_night,0
"Categories: Cocktail Bars, Lounges, Nightlife, Bars | Review: Tasty beverages and cozy atmosphere, perfect for a Tuesday night cocktail. Order at the bar even if sitting at a table. Small enough place, so not a problem ordering and getting drinks from the bar.",late_night,6
"Categories: Bakeries, Sandwiches, Food, Restaurants, American (Traditional) | Review: Great spot...wonderful service.   But the icing on the cake...David Segall........the best live music in SB ever :)",study_spot,1
"Categories: Nightlife, Bars, Tiki Bars, Cocktail Bars | Review: Stumbled upon this bar Sunday around 3pm while we were exploring Funkzone; it was relatively empty so we were able to sit wherever we wanted. 

The bartender is knowledgeable and accommodating, the cups for cocktails are very instagram-able if that's your thing, and the decor is well thought out with open-air beach vibes. 

The drink list is LONG and had something for everyone in our group- strong drinks, creative drinks, and twist on classic drinks. 

Definitely recommend a pit stop here if you're in the mood for a creative cocktail!",late_night,6
"Categories: Sandwiches, Restaurants, American (New) | Review: Best sandwiches ever! I never loved the thought of living in SB for 2 years (you can hate me all you want) but this was one of the things/places that made me grow to love the city.

I used to go every Sunday night while I was waiting for my laundry to dry next door and order a #22 (roast beef with avocado I believe) with a small diet coke. The owner, Arash was always there and always greeted me with a smile and hug. He always remembered my usual and we would just sit a watch either football, baseball or basketball. 

The ingredients are always fresh and sandwiches quickly made. What amazed me the most is that after 2 years of not being able to return, he still remembers me and my order! So if ever you visit Santa Barbara, I highly recommend stopping by for a sandwich. It's worth it!",study_spot,1
"Categories: Food Delivery Services, Food, Specialty Food, Fruits & Veggies, Nutritionists, Health & Medical | Review: I met Mia working on her apartment. I was immediately impressed by her positive can do attitude. It takes a special person to turn a disaster like COVID into an opportunity. She took her skills form years as a resort chef and made them available to locals who may not be able to go to the posh resorts even if they were open. 
She takes time to talk with each new eater to learn their likes and dislikes and comes up with a new surprise for them as often as they would like. 
My wife and I have been very happy so far. My daughter can be a little harder to please but I think that is partially my fault for spoiling her. Anyway if you are looking for an affordable alternative to wondering what to make for dinner at least several nights a week I would highly recommend giving her a try. 
Gary",upscale,4
"Categories: Thai, Restaurants, Japanese | Review: It was almost 2pm on a Saturday when we decided to get sushi for lunch. The Thai/Japanese combo was a little peculiar but we were starving so we gave it a shot. There were only 2 other tables occupied and our server arrived with a big smile. 

We ordered the ""Love Shrimp"" which was 6 grilled shrimp on skewers with a Thai spicy (really spicy) dipping sauce. The shrimp were fresh and tasty. We love the spicy but maybe not when you're going to eat something as delicate as sushi/sashimi afterwards since your taste buds need a minute to get back to normal in between bites. Also, the Thai chili spicy and the Japanese wasabi spicy get you at different spicy levels so that's also something to think about. 

Then I got the Sushi Combo which was 7 orders of sushi (chef's choice, I like that) plus a choice of Cal or spicy tuna roll. I got the latter. The chef's choice for the day was, yellowtail, tuna, seared tuna, albacore, salmon, mackerel and...can't remember one more. I loved 5 out of the 7 and the spicy tuna was good, not great. What I loved about the sushi was how small the rice was. My pet peeve is sushi with big roll of rice. The sashimi slices were really thick (borderline too thick) and big but 5 out of 7 were so tasty, even when my little ball of rice was already gone. It was like I had the sashimi plate. The salmon was also exceptional. 

My husband had an order of his favorite, salmon sushi, as well as the shrimp and asparagus tempura roll. He liked them both and ate most of my spicy tuna roll. 

So the sashimi quality was great. I'm not sure why they decided to combine Thai and Japanese...the decor was a bit mismatched and confusing.  I'm not sure if I'd go here if I wanted Thai food. 

They should really start a lunch special bento box or a lunch-sized sushi combo to feed the lunch crowd. They only have one menu for lunch/dinner but it's basically a dinner menu so the prices are a bit high for lunch and so are the portions. I would definitely like to see them do a busier lunch with a lunch menu.",date_night,0
"Categories: Asian Fusion, Seafood, Restaurants, Poke, Food | Review: This place surprised me in so many ways. 1) the prices are not bad at all, 2) you get a very generous portion of fish (this coming from a male who eats A LOT), and 3) the staff was super upbeat and friendly. Great place to use your AXXESS!",trendy,5
"Categories: Burgers, Restaurants | Review: patty melts and french fries. YUM YUM YUM!!!
This place always hits the spot. From the delicious homemade shakes, to the killer tuna and char burgers, this hits THE SPOT :)",casual_hangout,2
"Categories: Restaurants, American (Traditional), Food Delivery Services, Caterers, Venues & Event Spaces, Cocktail Bars, Bars, Wedding Planning, Nightlife, Food, Event Planning & Services | Review: My husband and I could not have picked a more amazing place to get married.

Just after we got engaged, my fiance and I were both working two jobs.  I was applying to graduate school and the thought of also having to plan  a wedding on top of everything else we had going on was daunting, to say the least.  When we stumbled upon the Rincon Beach Club, it was like a miracle.  The facility already provided the food, the tables, the chairs, the dining ware, the lighting, the sound system, the service and the guidance!  To top it all off, the outdoor setting and ambiance is exactly what we were looking for.  Perfect for the summer evening wedding we were picturing.

When the big day came, Melissa (our on-site coordinator) took care of everything.  From coordinating the ceremony to reminding me to eat my dinner, she thought of everything so my new husband and I didn't have to.  Her experience and attention to all the details that were important to us made the night exceptional -- for us and all of our guests.  Even my impossible-to-please, has-a -critique-for-everything friend said it was the best wedding he had ever been to!

I highly recommend this venue to anyone looking for a budget-friendly venue in the Santa Barbara area that caters to the patrons that need more than a little help planning an event.  Their reputation throughout Santa Barbara is well known for having delicious food and excellent service.  If I had to plan my wedding all over again, I'd still choose the Rincon Beach Club as my venue.",late_night,6
"Categories: Thai, Restaurants, American (New), Pop-Up Restaurants, Asian Fusion | Review: I had the Pad Thai, Pineapple curry, Tom yum! It was all amazing and the service was excellent! I will definitely be back soon!!",trendy,5
"Categories: Arts & Entertainment, Food, Wineries | Review: Awesome?  Can't say that here since Municipal owns that word.  I bring that up because Dave Potter who is the owner and wine maker for Municipal is also the owner and winemaker for Potek.    This new wine label is going to be a higher end label.  Grapes sourced for Potek are carefully selected and would more often than not be considerably more expensive than most wineries would normally use.  While I feel Dave is the master of the blend, Potek is focused more on varietals.

The winery is outside of the Funk zone and is in the new Mill building!   A very nice space and is a producing winery.   The tasting area is spacious and quite beautiful.  They have a courtyard which will be shared by the other tenants of the building as well as their own private patio.   Once the restaurant opens next door they will be doing sit-down wine and food pairings by reservation.

I visited Potek during an extended soft opening.  We tasted a dry Riesling which is made in a process more commonly used for red wines.  Skins are left in after pressing and removed later.  We also had a tasty Pinot Noir as well as a Syrah.   

The winery will be open to the public on or around August 1st.",upscale,4
"Categories: Restaurants, Asian Fusion | Review: Cute design outside and inside! 

We ordered the chicken wings, crispy rice salad, and weeping brisket. All pretty good! Probably wound order the crispy rice salad again though because it was mainly deep fried rice and not much else. Interested in trying some of their new items! 

They partnered with a cute froyo place in the same building! We got the mango sticky rice froyo",trendy,5
"Categories: Cocktail Bars, Farmers Market, Tapas Bars, Food, Desserts, Nightlife, Asian Fusion, Restaurants, Tapas/Small Plates, Bars, Indonesian | Review: They included a 20% service charge in the price of the food in advance, but the taste and service of the food was terrible. They included sparkling water that I didn't order. They didn't apologize and haven't refund yet.  I think she did it on purpose and that was clearly racist behavior. They even sell Asian food. The chef who makes Mie Goreng must have never eaten Mie Goreng before.",date_night,0
"Categories: Restaurants, American (New) | Review: So let me start by saying.... When u walk in the place is unimpressive. However, Roy works magic when he cooks. We had the cream of artichoke soup which was an oral orgasm, pork loin which was an amazing mixture of sweetness and tenderness, the chicken Marsala was also amazing and the flavors in the pasta with chicken pasilla and jalapeño cream sauce was a delight. Roy you are the first 5 out of 5 I have given. If you have the opportunity to stop by I highly recommend you do.",casual_hangout,2
"Categories: Restaurants, American (New), Delis, Breakfast & Brunch, Tapas/Small Plates, Cafes | Review: Great lunch menu, especially salads, if you can sit outside.  Inside, the environment is dull, and they need to bring bright colors and a good designer.  On the other hand, outside is lovely.  Therefore, wait for a table outside and you won't regret it.",family_friendly,3
"Categories: Restaurants, Food, American (New), Wine Bars, Nightlife, Venues & Event Spaces, Bars, Event Planning & Services | Review: In terms of major cities in California, San Diego, San Francisco and Los Angeles have always had a special place in my heart. But with this recent trip up to central California, it seems that Santa Barbara will be making this triad of favorites a quartet.

It's been a while since I've been in Downtown Santa Barbara... so long that I hardly remember it. Nonetheless, I fell instantly head over heels for this little section of the coastal city. With its impressive landmarks and affable locals, what's not to love? 
And of course, a block of restaurants that would make any epicure squeal with delight.

On this particular night, we decided to try Jane, a restaurant just a couple stores down from the prodigious Arlington Theatre, and we were far from disappointed.

We were seated immediately at 6 or so on a Friday night, in a stunning ambiance. The menu is full of original dishes that play up what would otherwise be considered traditional. After a minute or so, our group decided on splitting the ""Pots"" of Eggplant Pate and Olive Tapenade and the Goat Cheese Pancakes with Smoked Salmon as appetizers. I ordered the Half Papaya & Dungeness Crab salad, two others the Veal Marsala and the last person ordered the Grilled Duck Breast. We already planned ahead on finishing the meal with a slice of Coconut Cake. Since we ended up sharing everything anyway, here's my take on it all:


""Pots"" of Eggplant Pate and Olive Tapenade
Though both ""pots"" (which were really just cups) of pate and tapenade were very good, I liked the eggplant pate just a bit better because it had a softer texture and flavor. The olive tapenade was just a bit bitter, but still very tasty.

Goat Cheese Pancakes with Smoked Salmon
Though at first glance it doesn't look like much, I couldn't agree more with the serving. Goat cheese can be extremely rich, and too much of it can really kill a dish with a lot of potential. So in this case, having a smaller portion for this type of dish, just a little salty and creamy but flavorfully harmonious in every way, was ideal.

Veal Marsala
WOW. The veal could not have been cooked any better! Though thin, it was so juicy and the marsala sauce was to DIE for. Smoky and earthy, I could have eaten this dish ten times over. Not to mention, the side dishes - linguine and mixed vegetables - were also good, attesting that they pay attention to EVERYTHING, not just the main.  

Grilled Duck Breast
Though just the tiniest bit gamey for my taste, the duck was also cooked to perfection. The wine sauce added sophistication as did the sauteed ginger. Yum!

Half Papaya & Dungeness Crab salad
Unfortunately, there was one thing that held this whole entire experience back - this salad. Otherwise, Jane would have absolutely been five stars in my book. There was hardly any dungeness crab to be seen, and the portion was, admittedly, pretty small for a meal salad. Don't get me wrong - the salad was fresh and the curry dressing that came with it was delicious, but if the table had not shared everything, I probably would have left Jane still hungry.

Last but not least....

Coconut Cake
WOW. Light, fluffy, moist, sweet... everything you would want to find in a great cake. The anglaise that came with it was thin and creamy and -- this description does not do justice for this wonderful dessert. 

Jane is a great place to dine. The service is quick, the food is outstanding and the ambiance is one-of-a-kind. My only regret was ordering a salad... but otherwise, everything else was terrific! I can't wait to be back in Downtown Santa Barbara!!",date_night,0
"Categories: Mexican, Restaurants | Review: Excellent authentic Mexican food. Lots of choices and GREAT salsa and chips. Really good veggie burrito. Will return",trendy,5
"Categories: Restaurants, Food, Breweries, American (Traditional), Brewpubs | Review: We were seated and waited for over 10 minutes and never got any type of service. Nobody came to ask us for drinks, appetizers, or even a welcome. Plenty of staff and people all around us had food and drinks. Seems a bit odd and unfortunate to me.",late_night,6
