input_text,vibe_label,label
"Categories: Cupcakes, Bakeries, Food, Breakfast & Brunch, Restaurants, Coffee & Tea | Review: If you are going to order from crushcakes for a wedding or party read this first!!!!!!

This place is absolutely horrible!!!! We ordered 100 cupcakes and a 6 inch round cake cake for my daughters sweet 16 this weekend. I tried to place the order 2 weeks ago but no one would get back to me, it took a week for anyone to even respond to me after trying to reach them several times. This should have been my first indicator of the horrible customer service. Since there was no where else to go to get ""fancy cupcakes"" in Santa Barbara County we still placed the order. 

We picked up our order on Friday afternoon, we loaded them in our car in the boxes and bags THEY provided. When we arrived at our house EVERY SINGLE cupcake was squished, falling apart and frosting everywhere... They were an absolute mess. EVERY SINGLE ONE. This is over 400 dollars in cupcakes and cake mind you... 

I called them to tell then what had happened and they put me on the phone with the owner Shannon Noormand. After telling her what had happened she proceeded to yell at me on the phone in front of her co-workers and customers (I know this because she told me just before) that it's not her problem and that she would not give me any type of refund for these destroyed cupcakes, that was completely their fault because they packaged them in flimsy boxes and stacked them on top of each other. 

Who conducts business like this!?!? CRUSHCAKES AND SHANNON NOORMAND. 

This entire thing was such a catastrophe that we ended up having to THROW AWAY every last cupcake and buy new ones at Von's last minute because there was no other options. 

Let me tell you... The ones we purchased at Von's tasted just as good and they 1/16 of the price of Crushcakes. 

I am in the process of disputing this purchase with the credit card company. 

NEVER IN MY LIFE HAVE I HAD SUCH HORRIBLE CUSTOMER SERVICE ESPECIALLY FOR THE OWNER TO ACT THIS WAY.

I will never return there and will NEVER recommend them to anyone. 

HORRIBLE CUSTOMER SERVICE, THE OWNER IS A TERRIBLE PERSON AND THEIR CUPCAKES ARE NO WHERE NEAR WORTH THE PRICE.

DO NOT GO TO CRUSHCAKES!!!!'",study_spot,1
"Categories: Food, Coffee & Tea | Review: The staff is not the friendliest and even the customers that were there were not very nice.  But it is conveniently located off the freeway",study_spot,1
"Categories: Coffee & Tea, Food, Ice Cream & Frozen Yogurt, Restaurants, Cafes | Review: To say I was excited to try H&G Coffee would be an understatement. I saw they were opening and got in there opening weekend. They share a location with ParadICE (which is phenomenal) in Paseo Nuevo. While the shop is quaint in size, there is lots of space outside to enjoy your order. They are adhering to COVID protocols so make sure to wear a mask and give space to others. 

I went with my go-to drink and ordered a vanilla latte with whole milk. I don't know how else to describe my drink other than a smooth cup of comfort. The coffee wasn't too acidic and the vanilla flavor was just right. It was seriously delicious! The staff were also super friendly and engaged with my kids while we waited for the order. Love everything about this place and plan on going back!",study_spot,1
"Categories: Delis, Sandwiches, American (New), Restaurants | Review: Pickles and Swiss is the best sandwich shop in town and I make a habit of visiting whenever I am in the area.  The quality of the ingredients makes their sandwiches stand out and there is something for everyone on the menu.  My go-tos are the Chipotle Turkey Club and the Brunch Dunch but you can't go wrong with any of the sandwiches.  I recently tried one of their cookies for the first time and instantly regretted not doing it sooner.  The staff are really friendly and have on numerous occasions offered some great suggestions such as adding Sriracha to my Eggplant Parma - try it, you won't regret it!",study_spot,1
"Categories: Restaurants, Thai, Food, Chicken Wings, Ice Cream & Frozen Yogurt, Desserts | Review: Great food and portions / service staff is exceptional as well. Lunch menu is best value but nothing is to expensive",upscale,4
"Categories: Mexican, Restaurants, Seafood | Review: This place can be a hit and a miss.
The happy hour is really good I can't complain. My favorite drink is the Paloma. It's a Margarita with grape fruit! OMG to die for!! Happy Hour all day Sunday is great!!!
The service and the food is where i only give this a 3 star. Service is only ok when sitting at the bar. There is a awesome bartender named Dominic so hope you get him!  The food is ehhhh.....not that great but not that bad. In the middle. I would go there for the happy hour and drinks :)",late_night,6
"Categories: Restaurants, Mexican | Review: Among the best in Santa Barbara. Great tacos and nachos, good prices for the area. Seating is mostly outside.",casual_hangout,2
"Categories: Food, Ice Cream & Frozen Yogurt, Desserts | Review: funk zone location. winter limited flavors include winter pear crisp, blood orange, and vanilla grapefruit.  nice strong flavor and smooth texture
classics like eureka lemon and marionberries",trendy,5
"Categories: Cocktail Bars, Fish & Chips, Nightlife, Seafood, Restaurants, Bars | Review: Food needs work.
Dont have the Dungeness crab .It is  not prepared properly and the shell is fully on and its a long gruelling fight to get to the crab.I sent it back and they suggested the Crab Louis salad but that crab tasted like  canned and was super salty.
I have been here about 6 times as its in my area  and is open later than some restaurants but ive never been impressed with the food which is mediocre. 
View of harbour is very nice.
Staff is polite but not well trained.",late_night,6
"Categories: Nightlife, Seafood, American (Traditional), Bars, Restaurants | Review: Pros - great, great view off the pier! 
Great, strong drinks!
Good service 

 Cons- food isn't great! Had their fish taco (not impressed!)",late_night,6
"Categories: American (Traditional), Restaurants, Bars, Nightlife | Review: What a cool hidden treasure of the 154. If your into California history and good food this is your place. Save room for dessert.. the pecan pie is off the charts!",casual_hangout,2
"Categories: Ice Cream & Frozen Yogurt, Food, Desserts | Review: Excellent ice cream but wildly expensive for small portions. Terrific if you feel like splurging on a treat. Very little parking. Lot is tiny and you may want to be sure your collision insurance is current. Well advised to try the street.",upscale,4
"Categories: Bars, American (New), Tapas Bars, Restaurants, Nightlife | Review: My girlfriend and I both SB locals have been hesitant to come here since the change but after visiting we where not disappointed one bit. After looking over the drink and food menu we asked the bartender, Raul, to order us his favorite appetizer and suprise us with the best drinks. Everything was amazing. The staff here made our ordinary date night extra ordinary",late_night,6
"Categories: Restaurants, Middle Eastern, Bars, Nightlife, Mediterranean, Lebanese | Review: The ambience is excellent amongst the greenery and no spot is a bad one.  Excellent cuts of meat and exotic things to mix with.  Craft cocktails and good local beer on tap.  Can't recommend this place more for a dress up date night or even a casual night out.",casual_hangout,2
"Categories: Seafood, Bars, Wine Bars, American (New), Restaurants, French, Nightlife, Mexican | Review: We looked forward to our 3rd anniversary weekend in SB and dinner at Bouchon.  I'm a hobby chef and constantly search for top-shelf restaurant experiences. 

6:15 reservations on Saturday night May 17th   Reservations were honored and we were seated immediately.

We have only 2 ""dings"", but unfortunately the second one pretty much spoiled the experience.  Everything else was fine, however .  .  .

Our waiter was friendly and helpful, but unfortunately disappeared for long stretches. This meant no wine for the first few minutes after our entree was served.  The water glasses were empty as well.  Wine arrived quickly when we asked the bus person to get our waiter for us and he realized his mistake.

The main issue; My wife's rack of lamb, which was ordered medium rare, arrived essentially raw.  I prefer my meat very rare (carpaccio is a favorite), but this was obviously ""blue"" rare.  It was sent back, which is not always the worst thing to happen and doesn't necessarily spoil the experience.  Again, unfortunately, the lamb was returned to my wife now completely overdone.  Obviously no one cared enough to fix the problem properly.  Sad and too late now . . . so she picked at it, and finally ate some of my pork chop (which was excellent)

This is an expensive place, and this wasn't a subtle problem.  Either the chef, the expediter or the waiter should have noticed the obviously underdone lamb - and even though it was not addressed at the correct time, there's no excuse for the lack of care taken to ensure the mistake was handled.

It's a shame that all we could remember was a poorly prepared and handled rack of lamb.  It's nice that my wife complimented the fact that I'm a better chef than the one at Bouchon, but that's certainly not what I look for in an high-end, special occasion spot like this.  I expect a chef that leaves my home skills in the dust.

Why is it so difficult to get a true 5 star meal these days?",upscale,4
"Categories: Steakhouses, Local Flavor, Nightlife, Fish & Chips, Restaurants, Seafood, Cocktail Bars, Bars | Review: Went to Arch Rock Fish after reading the reviews. Liked the place for its ambience and food. Our waiter was a cool guy, very accommodating. 
The menu is short but has some good dishes. 
We ordered the calamari, the mussels spagetti and the vegetable pasta. 

The calamari was ok. 3/5
the mussels spagetti was great. it went very well with the bread too. 4/5
the vegetable pasta was ok. 3/5

In all this was a good experience just not a exceptional one. the ambience of the place is cool.",date_night,0
"Categories: Restaurants, Asian Fusion, Food, Poke, Hawaiian, Seafood | Review: Best poke I've had, very nice place to eat at and love the atmosphere. The food tastes very fresh and cold. The boba drinks are also one of the best drinks I've had. Totally recommend this place",trendy,5
"Categories: Soup, Wine Bars, Restaurants, Nightlife, Bars, Italian | Review: Excellent location but bad food and dirty dishes. My wife and I went there on a weekend a couple of weeks ago; we ordered  a Lasagna and Pasta al Pesto: $40+ for something we could have cooked at home. The dishes and silverware looked really old and used, the plate had been used so many times that the scratches in it were noticeable from a distance.

Improve food quality, lower prices and buy new tableware and you'll be set for success.",date_night,0
"Categories: Food Trucks, Tacos, Mexican, Salad, Food, Restaurants | Review: Plain and simple: I waited over 30 minutes and paid $5 for half of a corn tortilla stuffed with some cheese.",family_friendly,3
"Categories: Restaurants, Breakfast & Brunch, American (Traditional), American (New), Southern | Review: I was so excited to try Tupelo Junction Café on our recent visit to Santa Barbara - I had heard good things from multiple sources. It did not disappoint. We had a perfect, homestyle, chill Saturday brunch.  We came in about 1 and they would close at 2 (until reopening for dinner), so it wasn't super packed. We had lovely service and ordered a bunch of yummy delicious, mostly fried ;), things, and some drinks.

Favorite was the fried chicken and waffle. The waffle had cornmeal in it and the batter on the chicken did too. The chicken was very well seasoned and cooked perfectly. It was great. Next favorite were the cheddar cheese hush puppies with spicy pepper jam. Fried balls of cornmeal - awesome. Add a gooey cheesy center - even better. Add some pepper jam to dip them in - perfection! The fried green tomatoes were good. But they were served on a corn and tomato sort of salsa. That was all good, but it made the bottom side of the ""fry"" a little soggy. Great flavor, just need a better presentation, I think, to avoid the sog factor. Finally, the cinnamon apple beignets. They were good but not really beignets, which I think of as more ""pillowy"", these were more dough-y, like taking some monkey bread, pulling off a piece and deep frying it. Can't really go wrong, but not really a beignet. And the crème anglais was great. 

We topped off the meal with a couple of drinks in mason jars - a margarita and the savannah Georgia. Both quite tasty. Long story short: we were stuffed and happy at the end of our meal. :) Add me to the fan club!",late_night,6
"Categories: Restaurants, American (Traditional), Active Life, Golf | Review: Service that exceeds expectations.  I lost my 5 iron at the course on a busy Saturday morning.  I called later in the day, and sure enough the staff found it and put it in a safe spot.  Since I live over two hours away, the staff member (Randy) agreed to ship it to me.  Randy was both kind and professional.  Thank you to the whole Sandpiper staff for continuing to provide excellent service.  I'll be back.",trendy,5
"Categories: Nightlife, Wine Bars, Bars, American (Traditional), Tapas/Small Plates, Tapas Bars, Food, Arts & Entertainment, Wine Tasting Room, Wineries, American (New), Restaurants | Review: Love supporting this small business especially during the current Covid-19 crisis. They have nightly takeout specials during this crazy time so i decided to give it a shot with their $18 Fish & Chips takeout special including salad & cheesecake. The fish was a very generous portion with three big pieces. I could've easily shared this with someone. I liked the crispy batter too.

I always love coming here because their food is great and their wine dispenser system is a huge hit. 

Please support our local, small businesses!

Thanks Michael for your hardwork and great food & service.",date_night,0
"Categories: Vegan, Vegetarian, Restaurants, Indian | Review: I came here a few more times since my first review and like the changes they made.  First, the naan is so much fluffier and fresher than the first time we dined here.  The price is a few dollars cheaper and each entree also includes basmati rice.  We usually order the fig walnut kofta.  I also like the chicken chettinad, made with tender chicken thigh, savory, greasy, and full of mustard seeds and curry leaves.  I tried the Sri Lankan eggplant dish and it kind of reminded me of Chinese eggplant, a little sour, a little sweet, lots of wok hei all mixed with pulpy soft eggplants.  Overall, I have really grown to like this place.  The most recent visit consisted of 6 adults and 2 kids and everyone enjoyed the food with the two vegetarians proclaim that it is the best Indian food they ever had.",family_friendly,3
"Categories: Breweries, Food | Review: The grand opening weekend at M Special was a blast! Outdoor seating and games, food trucks, live music, I had an amazing time.

I love the idea of this place; located in a warehouse with the feel of a true brewery. The warehouse is very close to the marketplace, but located in a more secluded area. I actually prefer that because the place is in a huge open space and the parking lot is huge. Everyone who works there is super friendly and kids were running everywhere that day dressed in M Special attire and selling these adorable hats. 

Growlers were 16/20 (16 for fill and 20 for first time purchase, I believe). And the standard cups were going at $5, typical for a brewery. 

Although options were limited, they had a good variety of beers. They had an IPA, a Hoppy Blonde, Traditional Blonde, American Brown, and more. I loved the American Brown. There are a couple more beers opening this week, so I'm definitely excited to try those! 

Free pretzels and water are a definite plus. :)",casual_hangout,2
"Categories: Delis, Sandwiches, American (New), Restaurants | Review: for cleanliness & safety 
 for service speed & friendliness 
 for fresh ingredients and a great menu
 for returning customer and would recommend 

I think I've only ordered 2 different things on the menu I loved them so much lol. The Turkey Chipotle Club is my go to. Although the name is misleading because it's not a club sandwich with 3 slices of bread, it's made on a ciabatta. 

I've also had their pesto chicken salad sandwich, bomb.com! The have a variety of cold and hot sandwiches or you can build your own. It's a bit on the pricey side depending on what you order but you definitely get your $ worth and don't leave hungry.",study_spot,1
"Categories: Dance Clubs, Nightlife | Review: One of the most low key gems on this block!! Best bar hands down! Mike the owner is the funniest guy you'll ever meet. Great drinks, great DJ, will definitely be back!!",late_night,6
"Categories: American (New), Mexican, Restaurants | Review: Staying in Santa Barbara for a mini vacation. Was craving Mexican and a hotel employee highly recommended this restaurant. Ordered the Burrito Mojado for $11, which could feed two people. Tasted AMAZING. Great flavor and presentation.
Place is busy and can get loud. Parking is limited (We walked.) Salsa bar had several options. Ordered at the desk, find a seat and your order is delivered to you. Fresh chips are also offered.",casual_hangout,2
"Categories: Mexican, Bars, Tex-Mex, Nightlife, Dance Clubs, Sports Bars, Restaurants | Review: It was my first time going to Santa Barbara and a couple of friends told me the place to go was Sharkeez. When I got there the bartender Alex was super helpful making the night extremely enjoyable. 10/10 would recommend and ask for the bartender Alex he would make sure your night goes smoothly.",casual_hangout,2
"Categories: Seafood, Restaurants, Steakhouses | Review: Checked the place out on a Sat night. Originally they gave us a wait time of 30-35 mins but it only ended up being about 10! So great start. It seems that you need a reservation to sit outside, which i will definitely do next time, but the inside setting wasnt bad. The drinks were a little expensive...but strong enough to make it worth it. I recommend the mai tai. Dinner was, again, a little expensive..most seafood entrees were between 22 and 27...BUT you get a ton of food and I got no where close to finishing.
My only complaint, isnt really even a complaint...but the waiters were a little awkward, which made the night a little more entertaining for my sister and I...but if thats something that bothers you than maybe try another place.
And they take Axxess so dont forget!",upscale,4
"Categories: Food, Vietnamese, Restaurants, Noodles | Review: My family and I drove down from Arroyo Grande to see my nephew and his gal, and to have some Vietnamese grub.  This is a good little mom and pop type noodle house.  The flavors and presentation are simple yet adequate.  I did not expect hardcore vietnamese food that you get in the bigger population centers...  everything was tasty and prepared well... go and enjoy!  This is a basic, all purpose Vietnamese cafe and does the triick nicely.",study_spot,1
"Categories: Breakfast & Brunch, Diners, Restaurants, American (Traditional) | Review: Great diner for an excellent breakfast. They can't do espresso drinks but you can get those next door. The eggs are excellently done and they are a little picky with substitutions on their menu (as in they don't allow subs) but I'm confident you will find something you like regardless.",family_friendly,3
"Categories: Coffee & Tea, Food, Desserts, Turkish, Restaurants, Bakeries | Review: This place is crazy, you HAVE to try the pistachio coffee. And try the desserts -crazy. A lot of them are really chewy. The staff is sooooo nice. Everyone was offering samples. The seating area was cute. The kids loved it.",study_spot,1
"Categories: Comfort Food, Asian Fusion, Chinese, Tapas/Small Plates, Noodles, Thai, Restaurants | Review: Delicious Hangover noodles wow spicy! If you like heat then those one is for you. If your sensitive to spice steer clear. Organic tofu was eh ok but the fresh veggies and noodles with sauces was the best.",trendy,5
"Categories: Food, Restaurants, Salad, Coffee & Tea, Breakfast & Brunch, Sandwiches, Bakeries | Review: The food here was phenomenal. We ordered the green breakfast bowl, which was unique and the sauce added a delicious flavor. Loved it. The turkey panini had jalapeños baked into the bread and it was very crunchy and delicious. The atmosphere both inside and on the patio was very nice and cute. Loved this place for a casual brunch.",study_spot,1
"Categories: Pizza, Restaurants, Italian, Vegan, Gluten-Free, Sandwiches | Review: Mesa pizza has always been a solid choice when I have a craving for pizza in sb. I have never had a single issue ordering through them, and they are always very friendly and courteous.",study_spot,1
"Categories: Restaurants, Breakfast & Brunch, Sandwiches, American (Traditional) | Review: Tried this breakfast spot by our Uber drivers recommendation and we were not disappointed! Great service, great food-it reminds me of good ma and pa home cooking. I highly recommend this to anyone who likes classic hearty breakfast food.",family_friendly,3
"Categories: Event Planning & Services, Nightlife, Tapas Bars, Spanish, Modern European, Bars, Cocktail Bars, Seafood, Venues & Event Spaces, Restaurants | Review: Our favorite Spanish restaurant! We had another amazing dining experience, last night. Incredible food and ambience; my husband was partially raised in Spain and vouches for its authenticity.  The staff goes above and beyond; definitely try the gambas, seafood paella, and sangria. Perfection all around with a dog friendly patio!",date_night,0
"Categories: Asian Fusion, Seafood, Restaurants, Poke, Food | Review: Everything is so flavorful .
I had ceviche and the miso soup! Sooo delish!!!! 

The crew is so nice and they work fast! 
Super friendly!",trendy,5
"Categories: Restaurants, Breakfast & Brunch, Latin American, Mexican, Seafood | Review: Chef Ramon is back in business! Corazon now has a full menu with some of the old favorites from their pop-up shop and lots of new creative dishes. Clearly this restaurant is about creating fresh, quality Mexican food and they do not cut corners. I ordered the pork belly taco and after one bite I immediately regretted not ordering a few more! The pork is tender and juicy and the other ingredients (salsa, peaches, & others) just created an outstanding medley of flavors. The homemade blue corn tortillas pull everything together and is one of many things that makes this place stand out. I also ordered the Norteño which was a flour tortilla with cheese, guacamole and delicious smoked steak asada, and a few other ingredients. This is also a must try. The other people in my group also ordered the Chicken Mole taco, shrimp taco & the beer batteries Lingcod taco. All were amazing and  fresh!

Corazon's new location is in the Santa Barbara public market. It is clear that they will bring in the foot traffic that the market has been lacking since its opening. This restaurant is a must try for anyone visiting or living in Santa Barbara. I'm already planning my next meal here. Might have to cancel a utility bill to make room for a bigger taco budget.",casual_hangout,2
"Categories: Breakfast & Brunch, Diners, Nightlife, Restaurants, Comfort Food, American (New), Burgers, Salad | Review: Delicious food! And very good service! Good! Good! Good! Amazing meatballs! Not like in ikea! Really perfect!!!:)",family_friendly,3
"Categories: Steakhouses, Local Flavor, Nightlife, Fish & Chips, Restaurants, Seafood, Cocktail Bars, Bars | Review: Happy hour ALL day Sunday, Can't beat that! $6 Sushi roll, $6 bloody Mary and $12 fish and chips....score. The ambiance is cozy and the bartenders are not only friendly but super cute ;) A must visit when in Santa Barbara.  It's off State street so its lets crowded. There is city parking off Ortega and Anacapa. Can't wait to come back!",date_night,0
