input_text,vibe_label,label
"Categories: Tex-Mex, Restaurants, Bars, American (Traditional), Nightlife | Review: I come to Chili's quite often, I love the honey chipotle bbq wings. The service is always  great and so is the food",casual_hangout,2
"Categories: Comfort Food, Asian Fusion, Chinese, Tapas/Small Plates, Noodles, Thai, Restaurants | Review: I crave the Northern Thai Noddle Curry on a weekly basis. Its soooooo delicious. It's become one of my guilty pleasures every time I go to visit my boyfriend on the weekends.",trendy,5
"Categories: Mexican, Restaurants | Review: The enchiladas were bomb! The halibut was tasty inside and the put plenty of it in the enchiladas.  The sauce is so yummy, the pastor tacos are also good.  To drink I had the horchata and it was delicious.",family_friendly,3
"Categories: Seafood, Restaurants, Fish & Chips, British | Review: Came here few days ago, had a great experience. The food tasted like fresh ingredients. the fish and chips that I ordered seemed pretty authentic British fish and chips style. Staff and decor was inviting and friendly. Definitely will be coming back regularly.",trendy,5
"Categories: Restaurants, Mexican | Review: Carlitos has cameras to keep an eye on their customers, too bad they don't keep an eye on the quality of their food. Food is expensive for what it is, and lacks depth of flavor. Sauces are oily and thin and beans and rice are slopped under the main entrees making everything taste the same. When brought to the managers attention, their hands are tied and do not take ownership of the situation, passing it off to the owner who will berate and belittle you for any constructive criticism.",upscale,4
"Categories: Vietnamese, Restaurants, Bars, Seafood, Wine Bars, Vegetarian, Nightlife, Noodles | Review: The chicken pho was amazing! I got it for take out and was able to eat it for two separate meals because the portions are huge. There is great flavor in the sauces as well. I also ordered the spring rolls which had an amazing peanut sauce! I will definitely be ordering from here again.",date_night,0
"Categories: Cocktail Bars, Farmers Market, Tapas Bars, Food, Desserts, Nightlife, Asian Fusion, Restaurants, Tapas/Small Plates, Bars, Indonesian | Review: So sad again, we waited for 20min for a server, had several walk by numerous times, we love to come in and get some drinks and an appetizer however we had to walk out... The kitchen and bar make such good food and drink... It's such a shame and disappointment the floor staff/servers can't keep up, it wasn't that busy.",late_night,6
"Categories: Mexican, Restaurants, Seafood | Review: Went to this restaurant for a bachelorette party and they were very accommodating. The previous restaurant booked had a fire and we were able to book a large reservation last minute.
 
With several orders and drinks to be made our waitress was extremely accommodating. She was able to take orders and amend them when needed. 

Food was delicious and there was very easy access to State Street and tons of cabs and Lyfts. I would recommend this restaurant for a quick snack of large parties.",upscale,4
"Categories: Sushi Bars, Restaurants, Japanese | Review: First time trying the sushi here and must say I wasn't disappointed. The prices were reasonable and the food tasted good and fresh. I tried the California shrimp tempura roll and it was soooo good. I was expecting a small roll but it was big compared to other places I've gone. My husband got the ca roll and teriyaki bowl special and that was a deal for the price. The workers were friendly and the place was clean. Will definately be back again when in the area.",date_night,0
"Categories: Mexican, Restaurants | Review: Great food. Great atmosphere.  Always busy.  A great dining experience. We eat here as our ""go to"" Mexican Restaurant in Santa Barbara.  Tacos Del Mar, Mole Enchiladas, Fajitas are exceptional.  Very good seafood selection as well.",casual_hangout,2
"Categories: Steakhouses, Sushi Bars, Restaurants, Japanese | Review: Came here for dinner after the urban wine trail on Saturday night. The place was packed but we managed to make a reservation the same day. We got the steak and the shrimp which was really good. 

Service was also good as well. I'm not sure why the low stars but I lived in SB for 4 years and this is one of its more famous places. I would definitely check it out if in the area.",date_night,0
"Categories: Restaurants, Desserts, Sandwiches, Food, Italian | Review: Really yummy italian food takeout at very reasonable prices! Got spaghetti with meatballs, lasagna, and a salad. Everything was delicious. I had leftovers of the spaghetti & meatballs and they were great a couple days later.",study_spot,1
"Categories: Lounges, Nightlife, Restaurants, Bars, Seafood, American (Traditional), Soup | Review: Really nice food and great craft beer selection. They didn't bring out our sides with the mains though and forgot about them. However they gave us 2 free desserts to compensate.",casual_hangout,2
"Categories: Salad, Restaurants, Pizza, Sandwiches, Italian | Review: Great spot on State Street. Called ahead and pizza was ready when we arrived since deep dish took 45 minutes to cook. They didn't even ask for a credit card, which was surprising but nice. We ate on the patio which is big and looks into the bar/restaurant or the street so good view either way. The pizza was a bit disappointing but I am from Chicago so maybe my expectations were high. Not somewhere I care to try again although the service was great.",casual_hangout,2
"Categories: Wine Tasting Room, Local Flavor, Food, Wineries, Arts & Entertainment | Review: This was a solid 5 star place for me. I must agree with other reviews, that this is one of the best spots in the funk zone. I was super impressed with their tasting menus! Yes, multiple menus! We decided to go for the ""Notary Public"" tasting, $12. We started with the chilled Chenin Blanc, and another white with a buttery finish. I savored these as the day was hot and we sat directly in front of a blasting fan. Our help was friendly and outgoing, plus he gave great remarks about each wine he poured. Next, we tried a few Cabernet Sauvignons - which are so difficult to enjoy when its warm out, even though we were indoors.

This stunning, rustic and trendy industrial tasting room was also equipped with not only bar seating, it had a communal table, smaller tables, a pastry case and open kitchen to order from and outside seating. For those that need water during your tasting (like us), there is a large self-serve container with mason jars by the entrance! I loved that we weren't rushed, and most of the large-bachelorette-type crowds had left so the environment was extremely enjoyable. I will definitely be coming back!",trendy,5
"Categories: Restaurants, Japanese, Sushi Bars | Review: Absolutely amazing experience here at Sun Sushi. Quality cuts and fantastic service. Get the six step salmon and uni. You will not be disappointed.",date_night,0
"Categories: Pizza, Sandwiches, Restaurants | Review: I finally gave this place a try  after walking by a few dozen times.  Nothing from this place stands out.  The decor: bland.  Food: even more mediocore.  I had the tex-mex pizza, supposedly their speciality.        The grilled chicken sandwich was also lackluster.  Sure, it maybe healthy,  but there are lots of options around with better taste and atmosphere.  Like Silvergreens. My reccomendation:  walk on by.",study_spot,1
"Categories: Wine Bars, Restaurants, Gluten-Free, French, Bars, Nightlife, Creperies | Review: Rating this restaurant with 5 stars is a total no-brainer.  The food is fresh, delicate, and perhaps has crack in it because I've wanted to go back there every day since my lunch visit.

OK, let's get something straight.  This is not some trendy, swanky, jazz-playing creperie.  Quite the opposite, in fact.  This place is charming, quaint, and simple.  The walls are decorated with personal keepsakes and antiques, not blown-up posters or French sayings.  Think of it more as your grandma's restaurant.  If you do that, you'll be delighted by the atmosphere.

People have complained about the servers speaking French.  Really?  Seriously?  In my opinion, it only adds to the experience (and isn't that what dining out is all about?).  Unfortunately, I think these ladies may have read these reviews because they spoke little French during my visit.  Too bad, really, I was looking forward to it.

The food was downright scrumptious.  If you're craving crepes, this is the place to go.  Look no further.  We ordered two crepes during our visit--the lemon squeeze and a custom crepe I requested (because I can be difficult sometimes).  The lemon squeeze has lemon juice, butter, and sugar on it.  It was slightly tart, sweet, and had a bit of a crispy texture.  So good (and only $4!).  My custom crepe contained strawberries, bananas, chocolate, and whipped cream.  So, so tasty.  It was so good, in fact, that I would only let my husband have one bite.

Husband loved his turkey/cheese/avo sandwich on a French baguette.  He couldn't get over how soft the bread was.  (I tasted it--He wasn't lying!)

Oh, how I wish this creperie was local to me.  Instead, I have the over-the-top trendy swankster.  So unoriginal!",trendy,5
"Categories: Restaurants, Bars, Caterers, Mexican, Salad, Event Planning & Services, Desserts, Food, Nightlife | Review: Fundamentals like black beans and homemade tortillas are a substantial cut above at Los Arroyos, in comparison with more mass market Mexican establishments.  However the price point is just too high for me to make frequent revisits--The tacos a mano dish includes two small soft tacos, beans, and rice.  With the chicken option, this will set you back $11.50.  No extra vegetables included, and only a very meager amount of cheese.  A more economical option is to takeaway order a few sides--such as a single taco and a side of beans--and supplement it with some of Santa Barbara's finest produce at home!",casual_hangout,2
"Categories: Nightlife, American (Traditional), Cafes, Restaurants, Wine Bars, Breakfast & Brunch, Bars | Review: Kim Cameron, Valencia, CA
I have eaten here countless times. I kept trying to find something I really liked because everyone else loved to eat here. I just never really liked it. I LOVE Breakfast Burritos & Phili Cheese Steak sandwiches, but I don't love theirs. The Breakfast Burrito is kind of boring & I always needed to add things to enjoy it (which increases the price quite a bit). It's huge, but instead of making it sooo big, I think they should make it smaller & add more ingredients (add extra cheese, potatoes, meat- steak/bacon/sausage, & remove some of the beans), & also start making a fresh, more traditional-Mexican style salsa (they use a store-bought-like salsa, which really ruins it for me...). Also, for the Phili sandwich, they use processed steak, & processed cheese (the kind where slices come individually wrapped). For me, it ruins the sandwich (I can make my own, easily, in such a way...). The breakfast Cottage Fries are really yummy, but sometimes they are inconsistent. One time my friend got hers & they were perfect, then I was served mine & they were black & overdone (same table!). Also, the other Mexican food I've tried is too Americanized. Anyway. The food is OK, but I just don't like it as much as everyone else, I guess...",study_spot,1
"Categories: Restaurants, Breakfast & Brunch, Cafes, Cajun/Creole | Review: Cajun brunch on the central coast? I was excited to try some Jambalaya here, and it's always nice to take a break from the drive along the ocean. 

I tried the Jambalaya and eggs, and the dish wasn't as hearty and seasoned as jambalaya should be. The dish did have a lot of shrimp and a decent quantity of meat, but overall lacked flavoring. The cornbread was also lackluster. The dish could've use more cajun seasoning and also put more on the eggs.

Props for serving novelty food, just needs to kick up the flavor a notch.",family_friendly,3
"Categories: Coffee & Tea, Breakfast & Brunch, Restaurants, French, Salad, Sandwiches, Desserts, Bakeries, Food | Review: Almost croissant was delicious - flakey and soft. They didn't skimp on the almond paste filling; also for almond lovers, topped with tons of almonds.

Walked in at 10 am. I was ordering to go but noticed all tables were full. Took a leisure walk on the Main Street and after over an hour later noticed that the tables were still full. Word must get around.  

I'd definitely visit again!",study_spot,1
"Categories: Nightlife, Dance Clubs, Bars | Review: So. Trashy. It was like a frat party for high school kids.",late_night,6
"Categories: Restaurants, Japanese, Ramen | Review: This place is always delicious!  I've been here too many times to count and I'm always happy with my food. My favorite is the Spicy aka ramen with thick noodle and pork belly. Though all their ramen is bomb.  A+",casual_hangout,2
"Categories: Restaurants, Mexican | Review: Love the food and ambiance. Downside we waited 30 minutes for our table despite having a reservation. They told us it was due to the people not leaving even though they had already paid. If that's the case they should put a time limit on reservations like other restaurant do. It's not acceptable to make people wait that long. Not impressed.",upscale,4
"Categories: Food, Restaurants, Mexican | Review: I have to honestly say, the worst customer service I have ever experienced. Long wait time, expensive plates for not enough portion. Even management skills are ridiculous. The owners son runs the restaurant while the father runs the food truck and his son has no management skills whatsoever. If I could give zero starts.. I would",upscale,4
"Categories: Seafood, Restaurants, American (New), French | Review: Amazing, unique, delicious meals.  Great service.  Wonderful appetizers,  dessert and wine. Had the duck. Best I've ever tasted. They took great care of our party of 14 on 1/13/17.. Husband is the chef and wife runs the front with a great staff ... and makes all the beautiful art gracing the walls.  Very kind, gracious people. What an awesome evening dinner experience!",date_night,0
"Categories: Sushi Bars, Restaurants, Japanese | Review: I love handrolls Mondays! Selected handrolls are only $1.99, my favorites are the salmon skin, fish tempura, and California roll!",date_night,0
"Categories: Restaurants, Mexican | Review: Expensive, and the food doesnt match the rates.  That being said, the food was still good and seeing as it kind of is a tourist trap, I accepted it!
Salsa with the chips was amazing.  We also got seated right away at 730 on a saturday night for 2 people.  Pretty good service as well.",upscale,4
"Categories: Cuban, Restaurants, Bars, Sandwiches, Nightlife | Review: The food was good but for the price it seemed pretty expensive. It's walk up ordering and pickup and they don't serve drinks except water. Self serve everything. So premium prices for rice, beans, and chicken doesn't make sense.
I enjoyed my food but not sure I'll be back on purpose.",upscale,4
"Categories: Vegan, Vegetarian, Restaurants, Indian | Review: We have been here twice, once during their soft opening and once this past week for takeout.  We were big fans of India Club so were happy to hear Indian is coming back in to the neighborhood.  I love the idea of sit down Indian and especially the fact that the chef tries to use all fresh local ingredients.  So on the positive side the food is really good from my opinion, we've had the Tikka Masala, Garbanzo bean dish, the South Indian chicken, lentils, rice, naan and samosas.  ALL really super delicious.  I love the way the dinner combos come on the trays when you eat in, and the servings when you do take out are nice size.  We have also found (contrary to some reviews here) that the wait staff are all VERY friendly and helpful.  The only con for us is the price.  When we did takeout for just my husband and I, the cost was about $60.  Which is not cost-prohibitive for a once in a while splurge on takeout (we have young kids so take out is nice.)  But it's not at a price point where we could work it into our normal takeout routine and go regularly, which is unfortunate.  In comparison, India Club would run us about half that when we did take out, and even Tamira (which the food is not nearly as good as Masala Spice) is much less expensive.  I understand they are not the same exact type of restaurants, but when comparing local Indian, this is on the higher end and probably comparable to Bibi Ji's on State Street which I am not sure is going to work on Calle Real in Goleta over the long term.  Anyway, we are glad they're here, the food is great, service has been very Goodland-like and friendly, and I hope they last.",upscale,4
"Categories: Restaurants, Chinese, Szechuan, Soup, Seafood | Review: Awesome Chinese food in Goleta. Everything we tried was really tasty, and they have a pretty solid menu with lots of options. The prices were a bit more expensive than we normally look for for dinner, but the portions are pretty large so it's not too big of a deal.",upscale,4
"Categories: Restaurants, Mexican | Review: DO NOT EAT HERE.  We've been going here for years and lately it is horrible.  Maybe the worst dining experiences I've ever had horrible.  I never write reviews, I really don't care that much, but our experience was that bad.  The few patrons in the restaurant were actually speaking with each other and describing their awful food and how long they'd been waiting.  We sent the ""cheeseburger"" back.  It looked like a microwaved school lunch or frozen food that would come with a frozen dinner.  I had an enchilada and taco combo that was cold and tasteless.  When I say tasteless I mean nothing...like it actually took the flavor out of my mouth.  How can beans and rice taste like terrible nothingness?!?!  We were there for over an hour and a half even though there were only 2 other customers.  The two waitresses were walking around and rubbing walls/counters/salt shakers with a dirty rag.  I don't know what the ""cook"" was up to.  It was strange and terrible and I implore you not to bother with this place.  What a shame?! Where is the owner?!",casual_hangout,2
"Categories: Italian, Restaurants | Review: Service was top notch, and the hostess was very sweet to us.  For an expensive Italian restaurant I would say our main courses were just average but not necessarily worth the money.  I can confirm the bread was some kind of joke, tasted like day old super market bread.  Probably wont be back for a long time.",upscale,4
"Categories: Delis, Gluten-Free, Fast Food, Salad, Sandwiches, Restaurants | Review: My friend and I were on a mission to find the best soup in SB. We walked in 5 minutes before closing on a cold, wet, rainy day and Owen was really nice and recommended the chicken orzo. Even though they were closing he let us sit inside and eat it. It was so good we had to order seconds, and then, he recommended the vegetarian chili and tomato bisque. We decided we just had to try them all. They were all amazing and so was the customer service. I will definitely go again.",study_spot,1
"Categories: Venues & Event Spaces, Cafes, Wine Bars, Event Planning & Services, Nightlife, Bars, Restaurants, American (New) | Review: I rarely give five stars but we had a very positive experience at the chef's counter at the wine cask. The chef counter is a special prix fixe three - course menu with wine pairings designed, presented and introduced by the chef, and built around seasonal ingredients. The night we had our reservation the chef was not there but his sous chef, Nick,  was an able understudy. This young sous chef impressed us with his creativity, cooking skills and poise.

We started with a perfectly cooked seared scallop in a parsnip sabayon dotted with dill oil and topped with a strip of fried parsnip that looked like bacon but tasted like sweet earthy crunchy perfection. There was also a swirl of angel hair pasta on the plate that at first I thought was superfluous but quickly realized was a wonderful textural foil to the scallop and a perfect medium to soak up the  juices and sauce. The dish was paired with an elegant Melville Chardonnay.

The second course was a fascinating and inspired dish of sea bass in black olive oil with mustard greens and caviar infused with star anise. The unexpectedly harmonious pairing of olive and star anise leads me to conclude that the young chefs in this kitchen are talents to watch and I hope the management continues to give them the creative room they need to grow.  My only quibble with the dish is that I wanted more of the black olive oil to balance the star anise. The Grenache was a perfect match.

Dessert by pastry chef Rosie was a moist and homey gingerbread redolent of apples and allspice served with a cinnamon ice cream, poached pears and a pear purée. The dessert wine pairing offered was a perfect compliment to this autumnal treat. The portion of gingerbread was a bit large I thought, although my companion had no 
problem polishing off his serving and some of mine.

Service was professional and friendly. The ambiance was inviting. We will definitely return for the chef's counter next time we are in the area.",upscale,4
"Categories: Cocktail Bars, Farmers Market, Tapas Bars, Food, Desserts, Nightlife, Asian Fusion, Restaurants, Tapas/Small Plates, Bars, Indonesian | Review: I will write this review in two parts, one for this restaurant's service and the second for its food.

Firstly, I will give Sama Sama Kitchen zero stars for its poor service and attitude after my dinner engagement. This is what happened. I called to make dinner reservations for a party of nine people. The hostess explained that I need to complete my reservation online through a site called Tock and that there would be a $15/person fee which will be refunded back to me after I check in at the restaurant. We showed up for our dinner with our full party of nine and had a fine evening at the restaurant. A couple of days later, I received an email from Tock that Sama Sama Kitchen had issued my reservation refund. However, the refund that I received was short by one person ($15). I wasn't certain that I was reading the refund statement correctly and I checked my credit card transaction record. Sure enough, the restaurant had shorted my refund. I called back the restaurant in the next afternoon and spoke to a gentlemen who took down my message and said that the evening hostess will give me a call back about the refund status. However, the restaurant did not call me back. The next evening, I made a call again to the restaurant  and was able to speak to a hostess and explained to her once again about the mistake. After the hostess put me on hold to check her records, she got back on the call to ask if I was the person who had called the day before to inquire about this refund. She told me that they had checked their records and would not issue a full refund because only eight people showed up. I explained that that is a mistake and I had several pictures taken at the dinner clearly showing I had nine people in my party and I am ready to send her my pictures to prove that fact. After a second of awkward pause, she agreed to refund back the full reservation fee which I have now received the following day. 

My two complaints about this incident:
1. Ignoring your customer's inquiry. Why didn't the restaurant call me back to let me know that they will not issue a refund because they thought I didn't show up with my full party? Do they think their customer will forget about their inquiry if they think about returning to the restaurant next time? Do they care about getting repeat customers?
2. The unapologetic attitude of the hostess/restaurant during my second call. I understand that people make errors. But I would be perfectly okay if you fix your mistakes. $15 is a very small amount to fret over. If your customer takes the time to call you twice to explain about the mischarge, you should be a bit more apologetic instead of being slightly standoffish and saying just a very curt ""thanks"" to end the call.

Now for my review about the food and my experience at the restaurant.
We ordered these dishes along with a bottle of cab:
Signature chicken wings 
Crispy rice salad 
Eggplant and pork ballado  
Crispy duck salad 
Mie goren (noodles)
Nasi goren jawa (fried rice)
Grilled spare ribs 
Tofu and broccolini

The food was good and delicious but not the most amazing Southeast Asian fusion food that I've ever had. I thought the spare ribs with a side of fried yams and the chicken wings stood out most. The crispy duck salad was also excellent with a good portion of duck meat.  

For desserts, we ordered the Date Cake which was okay and the Matcha-Raspberry Semifreddo which was missing the raspberry in the actual serving without any explanation from the server. I thought dessert was underwhelming and somewhat overpriced to me. 

Overall the service we received at the restaurant was good and friendly. However as other reviewers have mentioned, the restaurant tacks on an automatic 20% gratuity. This may explain some rocky inattentive service at the start when no server explained to us that we needed to scan a QR code to look at the menu online which took forever to load for those of us with T-Mobile provider phones. Also the server did not tell us about any specials, or asked us if we had any questions about the menu.",date_night,0
"Categories: Mediterranean, Restaurants, Salad, Greek | Review: We had the gyro signature plate and the halal lamb kabob. Both items tasted pretty good. I don't feel like they are worth the price. Particularly the lamb kabob is pretty expensive. There was about half the meat as what is shown on the menu picture on their website.",upscale,4
